{
    "$schema": "http://json-schema.org/draft-07/schema#",
    "type": "object",
    "title": "Accommodation Seed Schema",
    "description": "Schema for accommodation seed data",
    "properties": {
        "$schema": {
            "type": "string"
        },
        "id": {
            "type": "string",
            "description": "Accommodation ID (UUID)"
        },
        "slug": {
            "type": "string",
            "description": "URL-friendly identifier"
        },
        "name": {
            "type": "string",
            "description": "Name of the accommodation"
        },
        "summary": {
            "type": "string",
            "description": "Brief summary of the accommodation"
        },
        "type": {
            "$ref": "common.schema.json#/definitions/accommodationType"
        },
        "description": {
            "type": "string",
            "description": "Full description of the accommodation"
        },
        "ownerId": {
            "type": "string",
            "description": "ID of the accommodation owner"
        },
        "destinationId": {
            "type": "string",
            "description": "ID of the destination where the accommodation is located"
        },
        "isFeatured": {
            "type": "boolean",
            "default": false,
            "description": "Whether the accommodation is featured"
        },
        "contactInfo": {
            "$ref": "common.schema.json#/definitions/contactInfo"
        },
        "socialNetworks": {
            "$ref": "common.schema.json#/definitions/socialNetworks"
        },
        "price": {
            "type": "object",
            "properties": {
                "basePrice": {
                    "$ref": "common.schema.json#/definitions/price"
                },
                "additionalFees": {
                    "type": "object",
                    "properties": {
                        "cleaning": { "type": "number", "minimum": 0 },
                        "tax": { "type": "number", "minimum": 0 },
                        "taxPercent": { "type": "number", "minimum": 0, "maximum": 100 },
                        "lateCheckout": { "type": "number", "minimum": 0 },
                        "parking": { "type": "number", "minimum": 0 },
                        "perPerson": { "type": "number", "minimum": 0 },
                        "electricity": { "type": "number", "minimum": 0 },
                        "towelRental": { "type": "number", "minimum": 0 }
                    },
                    "additionalProperties": true
                },
                "discounts": {
                    "type": "object",
                    "properties": {
                        "weekly": { "type": "number", "minimum": 0, "maximum": 100 },
                        "monthly": { "type": "number", "minimum": 0, "maximum": 100 },
                        "lastMinute": { "type": "number", "minimum": 0, "maximum": 100 }
                    },
                    "additionalProperties": false
                }
            },
            "additionalProperties": false
        },
        "location": {
            "$ref": "common.schema.json#/definitions/location"
        },
        "media": {
            "$ref": "common.schema.json#/definitions/media"
        },
        "schedule": {
            "type": "object",
            "properties": {
                "checkinTime": { "type": "string", "pattern": "^([0-1]?[0-9]|2[0-3]):[0-5][0-9]$" },
                "checkoutTime": {
                    "type": "string",
                    "pattern": "^([0-1]?[0-9]|2[0-3]):[0-5][0-9]$"
                },
                "earlyCheckinAccepted": { "type": "boolean", "default": false },
                "earlyCheckinTime": {
                    "type": "string",
                    "pattern": "^([0-1]?[0-9]|2[0-3]):[0-5][0-9]$"
                },
                "lateCheckinAccepted": { "type": "boolean", "default": false },
                "lateCheckinTime": {
                    "type": "string",
                    "pattern": "^([0-1]?[0-9]|2[0-3]):[0-5][0-9]$"
                },
                "lateCheckoutAccepted": { "type": "boolean", "default": false },
                "lateCheckoutTime": {
                    "type": "string",
                    "pattern": "^([0-1]?[0-9]|2[0-3]):[0-5][0-9]$"
                },
                "selfCheckin": { "type": "boolean", "default": false },
                "selfCheckout": { "type": "boolean", "default": false }
            },
            "additionalProperties": false
        },
        "extraInfo": {
            "type": "object",
            "properties": {
                "capacity": { "type": "number", "minimum": 1 },
                "minNights": { "type": "number", "minimum": 1 },
                "maxNights": { "type": "number", "minimum": 1 },
                "bedrooms": { "type": "number", "minimum": 0 },
                "beds": { "type": "number", "minimum": 0 },
                "bathrooms": { "type": "number", "minimum": 0 },
                "smokingAllowed": { "type": "boolean", "default": false },
                "extraInfo": {
                    "type": "array",
                    "items": { "type": "string" }
                }
            },
            "additionalProperties": false
        },
        "seo": {
            "$ref": "common.schema.json#/definitions/seo"
        },
        "adminInfo": {
            "$ref": "common.schema.json#/definitions/adminInfo"
        },
        "tags": {
            "type": "array",
            "items": { "type": "string" },
            "description": "Array of tag names"
        },
        "features": {
            "type": "array",
            "items": {
                "type": "object",
                "properties": {
                    "name": { "type": "string" },
                    "hostReWriteName": { "type": ["string", "null"] },
                    "comments": { "type": ["string", "null"] }
                },
                "required": ["name"],
                "additionalProperties": false
            }
        },
        "amenities": {
            "type": "array",
            "items": {
                "type": "object",
                "properties": {
                    "name": { "type": "string" },
                    "isOptional": { "type": "boolean", "default": false },
                    "additionalCost": {
                        "$ref": "common.schema.json#/definitions/price"
                    },
                    "additionalCostPercent": { "type": "number", "minimum": 0, "maximum": 100 }
                },
                "required": ["name", "isOptional"],
                "additionalProperties": false
            }
        },
        "featureIds": {
            "type": "array",
            "items": { "type": "string" },
            "description": "Array of feature IDs (UUIDs)"
        },
        "amenityIds": {
            "type": "array",
            "items": { "type": "string" },
            "description": "Array of amenity IDs (UUIDs)"
        },
        "tagIds": {
            "type": "array",
            "items": { "type": "string" },
            "description": "Array of tag IDs (UUIDs)"
        },
        "faqs": {
            "type": "array",
            "items": {
                "type": "object",
                "properties": {
                    "question": { "type": "string" },
                    "answer": { "type": "string" },
                    "category": { "type": ["string", "null"] }
                },
                "required": ["question", "answer"],
                "additionalProperties": false
            }
        },
        "iaData": {
            "type": "array",
            "items": {
                "type": "object",
                "properties": {
                    "title": { "type": "string" },
                    "content": { "type": "string" },
                    "category": { "type": ["string", "null"] }
                },
                "required": ["title", "content"],
                "additionalProperties": false
            }
        }
    },
    "required": ["slug", "name", "summary", "type", "description", "ownerId", "destinationId"],
    "additionalProperties": false
}
