{
    "id": "036-accommodation-gualeguaychu-hotel-nido-silvestre-hotel-gualeguaychu",
    "$schema": "../../../schemas/accommodation.schema.json",
    "slug": "nido-silvestre-hotel-gualeguaychu",
    "name": "nido-silvestre-hotel",
    "summary": "Sumérgete en un ambiente natural en Nido Silvestre Hotel, ubicado en una zona tranquila de Gualeguaychú con un entorno verde cercano.",
    "type": "HOTEL",
    "description": "Sumérgete en un ambiente natural en Nido Silvestre Hotel, ubicado en una zona tranquila de Gualeguaychú con un entorno verde cercano. Ideal para quienes buscan combinar el confort de un hotel con la serenidad de la naturaleza, con fácil acceso a las playas, la ciudad y el Carnaval.\n\nEl hotel cuenta con 22 habitaciones confortables, muchas de ellas con vista al jardín o al entorno arbolado. Equipadas con aire acondicionado, calefacción, TV y baño privado. Ofrecemos habitaciones dobles, triples y familiares.\n\nEntre sus instalaciones, dispone de un jardín con piscina exterior y solárium, perfecto para relajarse. El hotel ofrece desayuno incluido en la tarifa, servido en su comedor. También cuenta con lobby y Wi-Fi gratuito. El estacionamiento es descubierto dentro del predio.\n\nSu ubicación es conveniente para acceder en pocos minutos en auto a las playas del río Uruguay, al centro de la ciudad y al Corsódromo. Nido Silvestre es la opción ideal para una estancia relajante en contacto con la belleza natural de Gualeguaychú, con el Carnaval cerca en temporada.",
    "ownerId": "039-user-cristina-romero",
    "destinationId": "005-destination-gualeguaychu",
    "isFeatured": true,
    "contactInfo": {
        "workEmail": "hola@nidosilvestrehotel.com.ar",
        "mobilePhone": "+549344615602868",
        "homePhone": "+543446438200",
        "preferredEmail": "WORK",
        "preferredPhone": "MOBILE"
    },
    "price": {
        "basePrice": {
            "price": 23000,
            "currency": "ARS"
        },
        "additionalFees": {
            "taxPercent": 21
        }
    },
    "location": {
        "state": "Entre Ríos",
        "zipCode": "2820",
        "country": "Argentina",
        "coordinates": {
            "lat": "-33.0075",
            "lng": "-58.5127"
        },
        "street": "Avenida Parque Sur",
        "number": "1500",
        "city": "Gualeguaychú",
        "neighborhood": "Zona Parque"
    },
    "media": {
        "featuredImage": {
            "url": "https://images.pexels.com/photos/271624/pexels-photo-271624.jpeg",
            "caption": "Fachada y jardín del hotel",
            "description": "Vista exterior de Nido Silvestre Hotel rodeado de verde",
            "state": "ACTIVE"
        },
        "gallery": [
            {
                "url": "https://images.pexels.com/photos/271624/pexels-photo-271624.jpeg",
                "caption": "Exterior",
                "description": "Vista frontal del hotel",
                "state": "ACTIVE"
            },
            {
                "url": "https://images.pexels.com/photos/271639/pexels-photo-271639.jpeg",
                "caption": "Piscina",
                "description": "Área de piscina y solárium",
                "state": "ACTIVE"
            },
            {
                "url": "https://images.pexels.com/photos/164595/pexels-photo-164595.jpeg",
                "caption": "Habitación doble",
                "description": "Habitación con camas individuales",
                "state": "ACTIVE"
            },
            {
                "url": "https://images.pexels.com/photos/271619/pexels-photo-271619.jpeg",
                "caption": "Habitación triple",
                "description": "Habitación con cama matrimonial y una individual",
                "state": "ACTIVE"
            },
            {
                "url": "https://images.pexels.com/photos/260922/pexels-photo-260922.jpeg",
                "caption": "Comedor",
                "description": "Salón desayunador con vista al jardín",
                "state": "ACTIVE"
            }
        ]
    },
    "schedule": {
        "checkinTime": "13:00",
        "checkoutTime": "10:00",
        "earlyCheckinAccepted": true,
        "earlyCheckinTime": "11:00",
        "lateCheckinAccepted": true,
        "lateCheckinTime": "22:00",
        "lateCheckoutAccepted": false,
        "selfCheckin": false,
        "selfCheckout": false
    },
    "extraInfo": {
        "capacity": 45,
        "minNights": 1,
        "maxNights": 14,
        "bedrooms": 22,
        "beds": 35,
        "bathrooms": 22,
        "smokingAllowed": false,
        "extraInfo": [
            "Piscina exterior disponible en temporada",
            "Desayuno incluido",
            "Estacionamiento descubierto gratuito",
            "Entorno natural cercano",
            "Cerca de playas y Corsódromo"
        ]
    },
    "seo": {
        "title": "Nido Silvestre Hotel - Naturaleza y piscina en Gualeguaychú | Carnaval",
        "description": "Hotel con jardín y piscina en Gualeguaychú. Ideal para relax, cerca de playas y Carnaval. Desayuno incluido.",
        "keywords": [
            "hotel",
            "gualeguaychú",
            "entre ríos",
            "piscina",
            "naturaleza",
            "carnaval gualeguaychu",
            "playas"
        ]
    },
    "featureIds": [
        "024-feature-private_pool",
        "018-feature-nature_proximity",
        "004-feature-carnival_proximity"
    ],
    "amenityIds": [
        "025-amenity-connectivity-wifi",
        "001-amenity-climate-control-air_conditioning",
        "012-amenity-climate-control-heating",
        "022-amenity-connectivity-tv",
        "018-amenity-kitchen-refrigerator",
        "011-amenity-climate-control-hair_dryer",
        "020-amenity-safety-smoke_detector",
        "008-amenity-safety-fire_extinguisher",
        "010-amenity-safety-first_aid_kit"
    ],
    "faqs": [
        {
            "question": "¿A qué distancia está la playa Ñandubaysal?",
            "answer": "La playa Ñandubaysal se encuentra a unos 10-15 minutos en auto desde el hotel.",
            "category": "location"
        }
    ],
    "iaData": [],
    "tagIds": ["016-tag-entre-rios"]
}
