{
    "$schema": "../../../schemas/accommodation.schema.json",
    "slug": "refugio-maravilloso-cabana-colon",
    "name": "refugio-maravilloso-cabana",
    "summary": "Descubre un verdadero santuario en Refugio Maravilloso, una cabaña apartada en un entorno natural idílico cerca de Colón.",
    "type": "CABIN",
    "description": "Descubre un verdadero santuario en Refugio Maravilloso, una cabaña apartada en un entorno natural idílico cerca de Colón. Diseñada para ofrecer paz y privacidad, esta cabaña es el escape perfecto para parejas o familias que buscan reconectar con la naturaleza y disfrutar de momentos especiales en un lugar verdaderamente maravilloso.\n\nLa cabaña cuenta con un dormitorio principal espacioso, un baño completo y un área de living-comedor integrada con una cocina totalmente equipada. Los grandes ventanales permiten que la luz natural inunde el espacio y ofrecen vistas espectaculares al paisaje circundante. La decoración es cálida y confortable, con detalles rústicos que complementan el entorno.\n\nEl exterior es simplemente impresionante. Una amplia terraza de madera con una pequeña piscina o hot tub (según la estación) es el lugar ideal para relajarse y disfrutar de las vistas al atardecer. Cuenta con asador y mobiliario exterior para disfrutar de comidas al aire libre. El extenso jardín ofrece senderos privados para caminatas y la posibilidad de avistar aves locales. La paz y la belleza del lugar te harán sentir en un refugio maravilloso.\n\nAunque ofrece total privacidad, la cabaña se encuentra a una distancia conveniente en auto del centro de Colón, sus playas y las Termas, permitiéndote disfrutar de lo mejor de ambos mundos: la serenidad del campo y el acceso a las atracciones urbanas y turísticas.",
    "ownerId": "owner-placeholder-id",
    "destinationId": "destination-placeholder-id",
    "isFeatured": true,
    "contactInfo": {
        "personalEmail": "info@refugiomaravillosocabana.com.ar",
        "mobilePhone": "+549344715714846",
        "preferredEmail": "HOME",
        "preferredPhone": "MOBILE",
        "homeEmail": "contacto@refugiomaravillosocabana.com.ar"
    },
    "socialNetworks": {
        "facebook": "https://facebook.com/refugiomaravillosocabanaok",
        "instagram": "https://instagram.com/refugiomaravillosocabanaok",
        "twitter": "https://twitter.com/refugiomaravillosocabanaok"
    },
    "price": {
        "basePrice": {
            "price": 26000,
            "currency": "ARS"
        },
        "additionalFees": {
            "cleaning": 4500,
            "taxPercent": 21
        },
        "discounts": {
            "weekly": 15,
            "monthly": 25
        }
    },
    "location": {
        "state": "Entre Ríos",
        "zipCode": "2840",
        "country": "Argentina",
        "coordinates": {
            "lat": "-32.2267",
            "lng": "-58.1517"
        },
        "street": "Camino Rural F",
        "number": "S/N",
        "city": "Colón",
        "neighborhood": "Zona Arbolada"
    },
    "media": {
        "featuredImage": {
            "url": "https://images.pexels.com/photos/2351836/pexels-photo-2351836.jpeg",
            "caption": "Cabaña en la naturaleza",
            "description": "Vista exterior de la cabaña con terraza y entorno natural",
            "state": "ACTIVE"
        },
        "gallery": [
            {
                "url": "https://images.pexels.com/photos/2351836/pexels-photo-2351836.jpeg",
                "caption": "Exterior y terraza",
                "description": "Cabaña con deck de madera y vistas",
                "state": "ACTIVE"
            },
            {
                "url": "https://images.pexels.com/photos/4050318/pexels-photo-4050318.jpeg",
                "caption": "Interior",
                "description": "Vista del living-comedor",
                "state": "ACTIVE"
            },
            {
                "url": "https://images.pexels.com/photos/6775268/pexels-photo-6775268.jpeg",
                "caption": "Dormitorio",
                "description": "Dormitorio principal",
                "state": "ACTIVE"
            },
            {
                "url": "https://images.pexels.com/photos/2062426/pexels-photo-2062426.jpeg",
                "caption": "Cocina",
                "description": "Cocina integrada",
                "state": "ACTIVE"
            },
            {
                "url": "https://images.pexels.com/photos/5997967/pexels-photo-5997967.jpeg",
                "caption": "Asador",
                "description": "Área de parrilla exterior",
                "state": "ACTIVE"
            },
            {
                "url": "https://images.pexels.com/photos/2104882/pexels-photo-2104882.jpeg",
                "caption": "Piscina pequeña",
                "description": "Piscina exterior o hot tub en la terraza",
                "state": "ACTIVE"
            }
        ]
    },
    "schedule": {
        "checkinTime": "15:00",
        "checkoutTime": "11:00",
        "earlyCheckinAccepted": false,
        "lateCheckinAccepted": true,
        "lateCheckinTime": "20:00",
        "lateCheckoutAccepted": true,
        "lateCheckoutTime": "12:00",
        "selfCheckin": true,
        "selfCheckout": true
    },
    "extraInfo": {
        "capacity": 4,
        "minNights": 2,
        "maxNights": 10,
        "bedrooms": 1,
        "beds": 2,
        "bathrooms": 1,
        "smokingAllowed": false,
        "extraInfo": [
            "Entorno muy privado",
            "Ideal para parejas o familias pequeñas",
            "Piscina exterior o hot tub (consultar disponibilidad)",
            "Senderos privados en la propiedad"
        ]
    },
    "seo": {
        "title": "Refugio Maravilloso - Cabaña privada cerca de Colón, Entre Ríos",
        "description": "Cabaña aislada con piscina/hot tub y vistas naturales cerca de Colón. Ideal para parejas y relax. Entorno tranquilo y privado.",
        "keywords": [
            "cabaña",
            "colón",
            "entre ríos",
            "privado",
            "naturaleza",
            "relax",
            "piscina",
            "escape"
        ]
    },
    "tags": [
        "colon",
        "cabin",
        "colon-cabin",
        "seed-example",
        "nature",
        "private",
        "swimming-pool"
    ],
    "featureIds": [
        "7b302e1b-6cf4-4e96-a41a-4ba95f27a33d",
        "a2c69258-f5eb-4ed0-b8fe-9766f08e4bab",
        "820ec336-953d-4d98-8d3a-d3dc0ec42da6"
    ],
    "amenityIds": [
        "84fb4c84-942d-4682-8cbd-5e0229697670",
        "8c8cc325-bd60-4de1-a961-edc232c8e03b",
        "dd386c1d-790a-4c32-ab8f-995829c2af59",
        "aa5b2f0b-2dbe-43af-96b3-a1d3202c4419",
        "d1ab58f3-0f1b-4217-864d-3b11926d5a69",
        "e5fa69c0-b8e8-431a-b508-14a211a54740",
        "55196c2d-3fa4-4797-ae33-798ca841f832",
        "8305de52-109d-48bb-8781-c7e837443809",
        "d525fc8e-d5e8-4425-8936-3bcd9dfa6897",
        "68987dfa-0982-4783-877e-3979d0a5ad1c"
    ],
    "faqs": [
        {
            "question": "¿Qué tipo de piscina tiene?",
            "answer": "Cuenta con una pequeña piscina exterior tipo 'plunge pool' o un hot tub, dependiendo de la temporada. Consulta al reservar.",
            "category": "amenities"
        },
        {
            "question": "¿Hay señal de celular?",
            "answer": "La señal puede ser limitada debido a la ubicación rural. Recomendamos disfrutar de la desconexión.",
            "category": "facilities"
        }
    ],
    "iaData": []
}