{
    "$schema": "../../../schemas/accommodation.schema.json",
    "slug": "rincon-natural-room-colon",
    "name": "rincon-natural-room",
    "summary": "Descansa en un ambiente sereno en Rincón Natural, una habitación privada dentro de una casa con jardín en un barrio tranquilo de Colón.",
    "type": "ROOM",
    "description": "Descansa en un ambiente sereno en Rincón Natural, una habitación privada dentro de una casa con jardín en un barrio tranquilo de Colón. Ideal para viajeros individuales o parejas que buscan un lugar cómodo y apacible para alojarse, con acceso a espacios verdes y a poca distancia de las atracciones.\n\nLa habitación privada es confortable, cuenta con cama matrimonial, ropa de cama, toallas y ventilador/calefactor. Tendrás acceso a un baño completo que puede ser privado o compartido dependiendo de la disponibilidad y la configuración de la casa. Los huéspedes tienen acceso a áreas comunes de la casa, incluyendo la cocina básica para preparar café/té o comidas sencillas, y el comedor.\n\nEl mayor atractivo es el jardín, un espacio verde donde podrás relajarte, leer o disfrutar del aire libre. La casa se encuentra en un barrio residencial, lo que garantiza tranquilidad, pero a una distancia conveniente en auto o bicicleta del centro de Colón, la costanera y las Termas. Es una opción económica y agradable para quienes valoran un entorno natural y una atmósfera hogareña.",
    "ownerId": "owner-placeholder-id",
    "destinationId": "destination-placeholder-id",
    "isFeatured": false,
    "contactInfo": {
        "personalEmail": "contacto@rinconnaturalroom.com.ar",
        "mobilePhone": "+549344715998614",
        "preferredEmail": "HOME",
        "preferredPhone": "MOBILE",
        "homeEmail": "reservas@rinconnaturalroom.com.ar"
    },
    "socialNetworks": {
        "facebook": "https://facebook.com/rinconnaturalroom",
        "instagram": "https://instagram.com/rinconnaturalroom",
        "twitter": "https://twitter.com/rinconnaturalroom"
    },
    "price": {
        "basePrice": {
            "price": 6000,
            "currency": "ARS"
        },
        "additionalFees": {
            "taxPercent": 21
        }
    },
    "location": {
        "state": "Entre Ríos",
        "zipCode": "2840",
        "country": "Argentina",
        "coordinates": {
            "lat": "-32.2137",
            "lng": "-58.1410"
        },
        "street": "Calle Los Ceibos",
        "number": "450",
        "city": "Colón",
        "neighborhood": "Barrio Residencial"
    },
    "media": {
        "featuredImage": {
            "url": "https://images.pexels.com/photos/271620/pexels-photo-271620.jpeg",
            "caption": "Habitación privada",
            "description": "Interior de la habitación en Rincón Natural",
            "state": "ACTIVE"
        },
        "gallery": [
            {
                "url": "https://images.pexels.com/photos/271620/pexels-photo-271620.jpeg",
                "caption": "Habitación",
                "description": "Vista de la habitación con cama",
                "state": "ACTIVE"
            },
            {
                "url": "https://images.pexels.com/photos/6489107/pexels-photo-6489107.jpeg",
                "caption": "Baño",
                "description": "Baño (puede ser privado o compartido)",
                "state": "ACTIVE"
            },
            {
                "url": "https://images.pexels.com/photos/2736388/pexels-photo-2736388.jpeg",
                "caption": "Jardín",
                "description": "Espacio de jardín de la casa",
                "state": "ACTIVE"
            }
        ]
    },
    "schedule": {
        "checkinTime": "14:00",
        "checkoutTime": "10:00",
        "earlyCheckinAccepted": false,
        "lateCheckinAccepted": true,
        "lateCheckinTime": "20:00",
        "lateCheckoutAccepted": false,
        "selfCheckin": false,
        "selfCheckout": false
    },
    "extraInfo": {
        "capacity": 2,
        "minNights": 1,
        "maxNights": 7,
        "bedrooms": 1,
        "beds": 1,
        "bathrooms": 1,
        "smokingAllowed": false,
        "extraInfo": [
            "Habitación privada en casa de familia",
            "Acceso a jardín y cocina básica",
            "Baño puede ser compartido",
            "Ideal para viajeros solos o parejas"
        ]
    },
    "seo": {
        "title": "Rincón Natural - Habitación privada en Colón, Entre Ríos",
        "description": "Habitación privada cómoda con acceso a jardín en barrio tranquilo de Colón. Económico, ideal para viajeros. Cerca de atracciones.",
        "keywords": [
            "habitación privada",
            "colón",
            "entre ríos",
            "económico",
            "viajero",
            "alojamiento",
            "jardín"
        ]
    },
    "tags": [
        "colon",
        "room",
        "colon-room",
        "seed-example",
        "budget",
        "nature"
    ],
    "featureIds": [
        "a2c69258-f5eb-4ed0-b8fe-9766f08e4bab",
        "0ddae569-fe9b-42cc-a800-d5f39e82196f"
    ],
    "amenityIds": [
        "84fb4c84-942d-4682-8cbd-5e0229697670",
        "dd386c1d-790a-4c32-ab8f-995829c2af59",
        "a0d0d566-3d4a-4bf4-8dbd-c23f54433ed3",
        "d1ab58f3-0f1b-4217-864d-3b11926d5a69",
        "8305de52-109d-48bb-8781-c7e837443809",
        "d525fc8e-d5e8-4425-8936-3bcd9dfa6897",
        "68987dfa-0982-4783-877e-3979d0a5ad1c"
    ],
    "faqs": [
        {
            "question": "¿El baño es privado?",
            "answer": "El baño puede ser privado o compartido con otros huéspedes, dependiendo de la ocupación de la casa. Consulta al reservar.",
            "category": "facilities"
        },
        {
            "question": "¿Puedo usar la cocina?",
            "answer": "Sí, tienes acceso a una cocina básica para preparar comidas sencillas o calentar alimentos.",
            "category": "amenities"
        }
    ],
    "iaData": [
        {
            "title": "Explorando los alrededores a pie o en bicicleta",
            "content": "Desde Rincón Natural, puedes explorar los alrededores caminando o alquilando una bicicleta. Los barrios residenciales cercanos son tranquilos y seguros para pasear. A unos 20-30 minutos en bicicleta puedes llegar a la zona de la costanera y algunas playas menos concurridas. También hay caminos rurales cercanos que son agradables para un paseo en bicicleta, ofreciendo vistas de la campaña entrerriana y plantaciones locales.",
            "category": "activities"
        },
        {
            "title": "Transporte en Colón",
            "content": "Para moverte por Colón, puedes utilizar taxis o servicios de remis. También hay un sistema de transporte público de colectivos urbanos que conecta el centro con diferentes barrios y la zona de playas más alejada. Si no vienes en vehículo propio, es conveniente conocer los horarios de los colectivos o tener números de taxis a mano. Desde el centro, muchos puntos de interés son accesibles a pie.",
            "category": "transport"
        }
    ]
}