{
    "id": "053-accommodation-paranacito-hotel-mirador-maravilloso-hotel-villa_paranacito",
    "$schema": "../../../schemas/accommodation.schema.json",
    "slug": "mirador-maravilloso-hotel-villa_paranacito",
    "name": "mirador-maravilloso-hotel",
    "summary": "Disfruta de vistas maravillosas al río y el Delta en Mirador Maravilloso Hotel, ubicado estratégicamente en Paranacito.",
    "type": "HOTEL",
    "description": "Disfruta de vistas maravillosas al río y el Delta en Mirador Maravilloso Hotel, ubicado estratégicamente en Paranacito. Ideal para quienes buscan confort y vistas panorámicas al entorno natural del Delta. Un lugar para relajarse y contemplar el paisaje único.\n\nEl hotel cuenta con 16 habitaciones confortables, muchas de ellas con balcón y vista panorámica al río o a las islas. Equipadas con aire acondicionado, calefacción, TV y baño privado. Ofrecemos habitaciones dobles, triples y cuádruples.\n\nEntre sus instalaciones, dispone de una terraza con solárium con las mejores vistas, perfecta para momentos de relax. El hotel ofrece desayuno incluido en la tarifa, servido en un comedor con vista al exterior. También cuenta con lobby y Wi-Fi gratuito. El estacionamiento es descubierto dentro del predio.\n\nSu ubicación permite acceder fácilmente a los puntos de interés de Paranacito y es una excelente base para explorar el Delta en lancha. Mirador Maravilloso Hotel es la opción ideal para una estancia con vistas inigualables en el corazón del Delta.",
    "ownerId": "033-user-alejandra-cortes",
    "destinationId": "008-destination-paranacito",
    "isFeatured": true,
    "contactInfo": {
        "workEmail": "info@miradormaravillosohotel.com.ar",
        "mobilePhone": "+549344615971733",
        "homePhone": "+543446236499",
        "preferredEmail": "WORK",
        "preferredPhone": "MOBILE"
    },
    "socialNetworks": {
        "instagram": "https://instagram.com/miradormaravillosohotel",
        "twitter": "https://twitter.com/miradormaravillosohotel"
    },
    "price": {
        "basePrice": {
            "price": 23000,
            "currency": "ARS"
        },
        "additionalFees": {
            "taxPercent": 21
        }
    },
    "location": {
        "state": "Entre Ríos",
        "zipCode": "2826",
        "country": "Argentina",
        "coordinates": {
            "lat": "-33.7056",
            "lng": "-58.6551"
        },
        "street": "Ribera del Paraná S/N",
        "number": "S/N",
        "city": "Paranacito",
        "neighborhood": "Zona Ribereña"
    },
    "media": {
        "featuredImage": {
            "url": "https://images.pexels.com/photos/271624/pexels-photo-271624.jpeg",
            "caption": "Fachada y entorno del hotel",
            "description": "Vista exterior de Mirador Maravilloso Hotel con vistas al río",
            "state": "ACTIVE"
        },
        "gallery": [
            {
                "url": "https://images.pexels.com/photos/271624/pexels-photo-271624.jpeg",
                "caption": "Exterior",
                "description": "Vista frontal del hotel",
                "state": "ACTIVE"
            },
            {
                "url": "https://images.pexels.com/photos/271639/pexels-photo-271639.jpeg",
                "caption": "Piscina",
                "description": "Área de piscina y solárium con vista",
                "state": "ACTIVE"
            },
            {
                "url": "https://images.pexels.com/photos/164595/pexels-photo-164595.jpeg",
                "caption": "Habitación con balcón",
                "description": "Habitación con balcón y vista parcial al río",
                "state": "ACTIVE"
            },
            {
                "url": "https://images.pexels.com/photos/271619/pexels-photo-271619.jpeg",
                "caption": "Vista desde la habitación",
                "description": "Vista al Delta desde un balcón",
                "state": "ACTIVE"
            },
            {
                "url": "https://images.pexels.com/photos/260922/pexels-photo-260922.jpeg",
                "caption": "Comedor",
                "description": "Salón desayunador con vista",
                "state": "ACTIVE"
            }
        ]
    },
    "schedule": {
        "checkinTime": "13:00",
        "checkoutTime": "10:00",
        "earlyCheckinAccepted": true,
        "earlyCheckinTime": "11:00",
        "lateCheckinAccepted": true,
        "lateCheckinTime": "22:00",
        "lateCheckoutAccepted": false,
        "selfCheckin": false,
        "selfCheckout": false
    },
    "extraInfo": {
        "capacity": 32,
        "minNights": 1,
        "maxNights": 14,
        "bedrooms": 16,
        "beds": 26,
        "bathrooms": 16,
        "smokingAllowed": false,
        "extraInfo": [
            "Muchas habitaciones con vistas al río o Delta",
            "Piscina exterior con solárium",
            "Desayuno incluido",
            "Estacionamiento descubierto gratuito"
        ]
    },
    "seo": {
        "title": "Mirador Maravilloso Hotel - Vistas al río en Paranacito | Delta",
        "description": "Hotel con vistas panorámicas al río y Delta en Paranacito. Piscina, desayuno, habitaciones con balcón. Ideal para amantes de la naturaleza y pesca.",
        "keywords": [
            "hotel",
            "paranacito",
            "entre ríos",
            "delta",
            "río",
            "vistas",
            "piscina",
            "naturaleza"
        ]
    },
    "featureIds": ["028-feature-river_view", "024-feature-private_pool"],
    "amenityIds": [
        "025-amenity-connectivity-wifi",
        "001-amenity-climate-control-air_conditioning",
        "012-amenity-climate-control-heating",
        "022-amenity-connectivity-tv",
        "018-amenity-kitchen-refrigerator",
        "011-amenity-climate-control-hair_dryer",
        "020-amenity-safety-smoke_detector",
        "008-amenity-safety-fire_extinguisher",
        "010-amenity-safety-first_aid_kit"
    ],
    "faqs": [
        {
            "question": "¿Se organizan excursiones por el Delta?",
            "answer": "Podemos ayudarte a contactar proveedores locales de excursiones en lancha por el Delta.",
            "category": "services"
        }
    ],
    "iaData": [],
    "tagIds": ["016-tag-entre-rios"]
}
