{
    "$schema": "../../../schemas/accommodation.schema.json",
    "slug": "sueno-calido-apartment-concordia",
    "name": "sueno-calido-apartment",
    "summary": "Disfruta de la calidez y el confort en Sueño Cálido Apartamento, un espacio moderno ubicado en una zona residencial de Concordia.",
    "type": "APARTMENT",
    "description": "Disfruta de la calidez y el confort en Sueño Cálido Apartamento, un espacio moderno ubicado en una zona residencial de Concordia. Ideal para parejas o viajeros que buscan un lugar tranquilo y bien equipado para descansar, con fácil acceso a las termas y atracciones de la ciudad.\n\nEl apartamento cuenta con un dormitorio principal con cama doble, un baño completo, y un área de living-comedor integrada con cocina equipada (heladera, microondas, anafe). Dispone de sofá cama, permitiendo una capacidad de hasta 3 personas. La decoración es acogedora y funcional.\n\nSituado en un edificio moderno, ofrece un refugio cómodo. Estás a pocos minutos en auto de las Termas de Concordia y el centro de la ciudad. Es una base práctica y confortable para tu visita, ofreciendo la paz de un barrio residencial con la cercanía a los puntos de interés.",
    "ownerId": "owner-placeholder-id",
    "destinationId": "destination-placeholder-id",
    "isFeatured": false,
    "contactInfo": {
        "personalEmail": "info@suenocalidoapartment.com.ar",
        "mobilePhone": "+54934515170979",
        "preferredEmail": "HOME",
        "preferredPhone": "MOBILE",
        "homeEmail": "hola@suenocalidoapartment.com.ar"
    },
    "socialNetworks": {
        "facebook": "https://facebook.com/suenocalidoapartment",
        "instagram": "https://instagram.com/suenocalidoapartment",
        "twitter": "https://twitter.com/suenocalidoapartment"
    },
    "price": {
        "basePrice": {
            "price": 12500,
            "currency": "ARS"
        },
        "additionalFees": {
            "cleaning": 2000,
            "taxPercent": 21
        }
    },
    "location": {
        "state": "Entre Ríos",
        "zipCode": "3200",
        "country": "Argentina",
        "coordinates": {
            "lat": "-31.3884",
            "lng": "-58.0221"
        },
        "street": "Calle Los Fresnos",
        "number": "150",
        "floor": "3",
        "apartment": "D",
        "city": "Concordia",
        "neighborhood": "Barrio Residencial"
    },
    "media": {
        "featuredImage": {
            "url": "https://images.pexels.com/photos/1011302/pexels-photo-1011302.jpeg",
            "caption": "Interior del apartamento",
            "description": "Vista del área de estar y cocina",
            "state": "ACTIVE"
        },
        "gallery": [
            {
                "url": "https://images.pexels.com/photos/1011302/pexels-photo-1011302.jpeg",
                "caption": "Living",
                "description": "Espacio integrado de living y cocina",
                "state": "ACTIVE"
            },
            {
                "url": "https://images.pexels.com/photos/164595/pexels-photo-164595.jpeg",
                "caption": "Dormitorio",
                "description": "Dormitorio con cama doble",
                "state": "ACTIVE"
            },
            {
                "url": "https://images.pexels.com/photos/2062431/pexels-photo-2062431.jpeg",
                "caption": "Cocina",
                "description": "Cocina equipada",
                "state": "ACTIVE"
            },
            {
                "url": "https://images.pexels.com/photos/2111769/pexels-photo-2111769.jpeg",
                "caption": "Baño",
                "description": "Baño completo",
                "state": "ACTIVE"
            }
        ]
    },
    "schedule": {
        "checkinTime": "14:00",
        "checkoutTime": "10:00",
        "earlyCheckinAccepted": false,
        "lateCheckinAccepted": true,
        "lateCheckinTime": "21:00",
        "lateCheckoutAccepted": false,
        "selfCheckin": true,
        "selfCheckout": true
    },
    "extraInfo": {
        "capacity": 3,
        "minNights": 1,
        "maxNights": 10,
        "bedrooms": 1,
        "beds": 2,
        "bathrooms": 1,
        "smokingAllowed": false,
        "extraInfo": [
            "Barrio residencial tranquilo",
            "Ideal para parejas o viajeros solos",
            "Cerca de Termas y centro"
        ]
    },
    "seo": {
        "title": "Sueño Cálido - Apartamento cómodo en Concordia",
        "description": "Apartamento moderno y confortable en Concordia. Ideal para parejas. Cerca de Termas y centro. Equipado y acogedor.",
        "keywords": [
            "apartamento",
            "concordia",
            "entre ríos",
            "termas concordia",
            "cómodo",
            "parejas",
            "equipado"
        ]
    },
    "tags": [
        "concordia",
        "apartment",
        "concordia-apartment",
        "seed-example",
        "thermal",
        "quiet"
    ],
    "featureIds": [
        "45973def-bdc7-47cd-8997-11d649dc3a4f",
        "bdc8b938-9599-428c-92a8-0bf932005ed7"
    ],
    "amenityIds": [
        "84fb4c84-942d-4682-8cbd-5e0229697670",
        "8c8cc325-bd60-4de1-a961-edc232c8e03b",
        "dd386c1d-790a-4c32-ab8f-995829c2af59",
        "a0d0d566-3d4a-4bf4-8dbd-c23f54433ed3",
        "aa5b2f0b-2dbe-43af-96b3-a1d3202c4419",
        "d1ab58f3-0f1b-4217-864d-3b11926d5a69",
        "e5fa69c0-b8e8-431a-b508-14a211a54740",
        "d525fc8e-d5e8-4425-8936-3bcd9dfa6897",
        "68987dfa-0982-4783-877e-3979d0a5ad1c"
    ],
    "faqs": [
        {
            "question": "¿Está cerca del centro?",
            "answer": "El centro de Concordia se encuentra a unos 5-10 minutos en auto o transporte público.",
            "category": "location"
        }
    ],
    "iaData": []
}