{
    "$schema": "../../../schemas/accommodation.schema.json",
    "slug": "sueno-apacible-house-liebig",
    "name": "sueno-apacible-house",
    "summary": "Disfruta de la paz y el espacio en Sueño Apacible House, una cómoda casa ubicada en un barrio tranquilo de Liebig.",
    "type": "HOUSE",
    "description": "Disfruta de la paz y el espacio en Sueño Apacible House, una cómoda casa ubicada en un barrio tranquilo de Liebig. Ideal para familias o grupos de amigos que buscan un lugar propio para descansar y disfrutar de la serenidad del pueblo histórico y el río Uruguay.\n\nLa casa cuenta con dos dormitorios y un baño completo. El living-comedor es integrado con la cocina, creando un espacio funcional. Está equipada con lo esencial para una estadía confortable. Puede alojar hasta 5 personas.\n\nEl exterior ofrece un jardín con parrilla, ideal para disfrutar de asados al aire libre. La ubicación en un barrio tranquilo garantiza serenidad. Estás a una distancia conveniente en auto o caminando de los restos históricos del Frigorífico Liebig y del acceso al río. Una opción práctica y apacible para tu estadía en Liebig.",
    "ownerId": "owner-placeholder-id",
    "destinationId": "destination-placeholder-id",
    "isFeatured": false,
    "contactInfo": {
        "personalEmail": "info@suenoapaciblehouse.com.ar",
        "mobilePhone": "+549345615656012",
        "preferredEmail": "HOME",
        "preferredPhone": "MOBILE",
        "homeEmail": "info@suenoapaciblehouse.com.ar",
        "website": "https://suenoapaciblehouse.com.ar"
    },
    "price": {
        "basePrice": {
            "price": 17000,
            "currency": "ARS"
        },
        "additionalFees": {
            "cleaning": 3200,
            "taxPercent": 21
        }
    },
    "location": {
        "state": "Entre Ríos",
        "zipCode": "3206",
        "country": "Argentina",
        "coordinates": {
            "lat": "-31.0542",
            "lng": "-58.1069"
        },
        "street": "Calle Los Ciruelos",
        "number": "88",
        "city": "Liebig",
        "neighborhood": "Barrio Residencial"
    },
    "media": {
        "featuredImage": {
            "url": "https://images.pexels.com/photos/1115804/pexels-photo-1115804.jpeg",
            "caption": "Casa en Liebig",
            "description": "Vista exterior de Sueño Apacible House",
            "state": "ACTIVE"
        },
        "gallery": [
            {
                "url": "https://images.pexels.com/photos/1115804/pexels-photo-1115804.jpeg",
                "caption": "Exterior",
                "description": "Fachada de la propiedad",
                "state": "ACTIVE"
            },
            {
                "url": "https://images.pexels.com/photos/1643384/pexels-photo-1643384.jpeg",
                "caption": "Living comedor",
                "description": "Espacio integrado de living y comedor",
                "state": "ACTIVE"
            },
            {
                "url": "https://images.pexels.com/photos/349749/pexels-photo-349749.jpeg",
                "caption": "Cocina",
                "description": "Cocina equipada",
                "state": "ACTIVE"
            },
            {
                "url": "https://images.pexels.com/photos/1454806/pexels-photo-1454806.jpeg",
                "caption": "Dormitorio",
                "description": "Uno de los dormitorios",
                "state": "ACTIVE"
            },
            {
                "url": "https://images.pexels.com/photos/5997965/pexels-photo-5997965.jpeg",
                "caption": "Parrilla",
                "description": "Parrilla exterior",
                "state": "ACTIVE"
            }
        ]
    },
    "schedule": {
        "checkinTime": "14:00",
        "checkoutTime": "10:00",
        "earlyCheckinAccepted": false,
        "lateCheckinAccepted": true,
        "lateCheckinTime": "20:00",
        "lateCheckoutAccepted": false,
        "selfCheckin": false,
        "selfCheckout": false
    },
    "extraInfo": {
        "capacity": 5,
        "minNights": 2,
        "maxNights": 15,
        "bedrooms": 2,
        "beds": 3,
        "bathrooms": 1,
        "smokingAllowed": false,
        "extraInfo": [
            "Barrio residencial tranquilo",
            "Parrilla exterior",
            "Ideal para familias",
            "Cerca del Frigorífico Histórico y el río"
        ]
    },
    "seo": {
        "title": "Sueño Apacible House - Casa en Liebig para familias | Frigorífico y Río",
        "description": "Casa cómoda para 5 personas en Liebig. Ideal familias. Parrilla, jardín. Cerca del Frigorífico Histórico y río Uruguay.",
        "keywords": [
            "casa",
            "liebig",
            "entre ríos",
            "familiar",
            "tranquilo",
            "parrilla",
            "frigorífico liebig",
            "río uruguay"
        ]
    },
    "featureIds": [
        "20e2f309-ce52-476f-92bc-a1352bfd5ce4",
        "a2c69258-f5eb-4ed0-b8fe-9766f08e4bab",
        "effbc352-e173-4e30-b7bf-89cb5082531e",
        "18c797f2-0f94-403d-bb28-a221742e1181"
    ],
    "amenityIds": [
        "84fb4c84-942d-4682-8cbd-5e0229697670",
        "8c8cc325-bd60-4de1-a961-edc232c8e03b",
        "dd386c1d-790a-4c32-ab8f-995829c2af59",
        "a0d0d566-3d4a-4bf4-8dbd-c23f54433ed3",
        "aa5b2f0b-2dbe-43af-96b3-a1d3202c4419",
        "d1ab58f3-0f1b-4217-864d-3b11926d5a69",
        "d525fc8e-d5e8-4425-8936-3bcd9dfa6897",
        "68987dfa-0982-4783-877e-3979d0a5ad1c"
    ],
    "faqs": [],
    "iaData": []
}